brand,commercial_number,BDM,transcript,total_bdm_terms_pct,comparatives,superlatives,unique_words,bdm_words,product_cat_name,product_cat_keywords,product_cat_brands,keyword_similarity,similar_phrases,shared_keywords,shared_keywords_count
Sprint,AD0396,1.0,Dear Verizon and Sprint would like to apologize for calling you a not a just really expensive Now were cutting your customers bills in half Discount applies to base rate plan Exclusions apply Which might make you look like a Sprint sprint Get unlimited talk text in the US and match your base data allowance Just turn in your old phone and lease or buy a new one with Sprint Easy Pay while on the Sprint network New plan may not be exact match Limited time offer Subject to credit and valid consumer wireless port Discount applied to voice text and data with a min rate charge Excludes taxes roaming apps premium content int services add I lines and device charges Other plans Jive prioritized bandwidth availability To improve data experience for the majority of users throughput varied or reduced on the network Max of lines per account No cash back party marks are property of their respective owners Restrictions apply ,0.6211180124223602,[],[],['premium'],['premium'],Telecommuniactions services,"['5G', 'LTE', 'network', 'sound', 'unlimited', 'data', 'taxes', 'fees', 'contract', 'reception', 'streaming', 'internet', 'limit', 'nationwide', 'WiFi', 'limited', 'switch', 'upgrade', 'customer service', 'bill', 'save', 'saving', 'reliable', 'fast', 'seamless', 'secure', 'affordable', 'flexible', 'efficient', 'innovative', 'responsive', 'advanced', 'powerful', 'uninterrupted', 'intuitive', 'global', 'high-speed', 'accessible', 'dynamic', 'modern', 'scalable', 'user-friendly', 'dependable', 'customizable', 'stable', 'cutting-edge', 'versatile', 'comprehensive', 'robust', 'adaptive', 'integrated', 'streamlined', 'crystal-clear', 'connected', 'clear', 'trusted', 'generation', 'connectivity', 'speed', 'coverage', 'reliability', 'communication', 'accessibility', 'technology', 'innovation', 'performance', 'service', 'integration', 'solutions', 'signal', 'bandwidth', 'efficiency', 'security', 'reach', 'features', 'mobility', 'voice', 'connections', 'broadband', 'control', 'freedom', 'clarity', 'support', 'simplicity', 'wireless', 'transmission', 'platform', 'compatibility', 'devices', 'experience', 'management', 'scalability']","['Mint', 'Sprint', 'TMobile', 'VerizonWireless']",0.42652857,['Dear Verizon and Sprint would like to apologize for calling you a not a just really expensive Now were cutting your customers bills in half Discount applies to base rate plan Exclusions apply Which might make you look like a Sprint sprint Get unlimited talk text in the US and match your base data allowance Just turn in your old phone and lease or buy a new one with Sprint Easy Pay while on the Sprint network New plan may not be exact match Limited time offer Subject to credit and valid consumer wireless port Discount applied to voice text and data with a min rate charge Excludes taxes roaming apps premium content int services add I lines and device charges Other plans Jive prioritized bandwidth availability To improve data experience for the majority of users throughput varied or reduced on the network Max of lines per account No cash back party marks are property of their respective owners Restrictions apply'],"['network', 'unlimited', 'data', 'taxes', 'limited', 'bandwidth', 'voice', 'wireless', 'experience']",9
TMobile,AD0514,0.0,"F Mobile P R E E N T JUSTIN Celebration Expert SAY SAY GOODBYE TO LIMITS at plans if congested top 3 may notice reduced speeds due to x regulatory fees included in mo service price See materials for specifics in your state POST YOUR MOVES F Mobile Pop Hello, I'm Justin Bieber, celebration expert. First, there was the high five. And then there was this. Grunt! Grunt strike! Grunt! From the spike, it evolved quickly. We got the shimmy, we got the shake, and the shimmy shimmy shake. Then there was T.O. We took it to the next level. That guy's got unlimited moves. And today, everyone wants things unlimited. Nice moves, kid. I'm not done yet. Say goodbye to limits. Introducing T-Mobile One. All unlimited, all in. Taxes and fees included. Everyone loves unlimited. Post your moves now, and I'm gonna share my faves. Where did this guy come from? Look at him dance. Unlimited moves. This guy's got the shimmy sham sham shimmy shake right there.",0.591715976331361,[],[],['First'],['First'],Telecommuniactions services,"['5G', 'LTE', 'network', 'sound', 'unlimited', 'data', 'taxes', 'fees', 'contract', 'reception', 'streaming', 'internet', 'limit', 'nationwide', 'WiFi', 'limited', 'switch', 'upgrade', 'customer service', 'bill', 'save', 'saving', 'reliable', 'fast', 'seamless', 'secure', 'affordable', 'flexible', 'efficient', 'innovative', 'responsive', 'advanced', 'powerful', 'uninterrupted', 'intuitive', 'global', 'high-speed', 'accessible', 'dynamic', 'modern', 'scalable', 'user-friendly', 'dependable', 'customizable', 'stable', 'cutting-edge', 'versatile', 'comprehensive', 'robust', 'adaptive', 'integrated', 'streamlined', 'crystal-clear', 'connected', 'clear', 'trusted', 'generation', 'connectivity', 'speed', 'coverage', 'reliability', 'communication', 'accessibility', 'technology', 'innovation', 'performance', 'service', 'integration', 'solutions', 'signal', 'bandwidth', 'efficiency', 'security', 'reach', 'features', 'mobility', 'voice', 'connections', 'broadband', 'control', 'freedom', 'clarity', 'support', 'simplicity', 'wireless', 'transmission', 'platform', 'compatibility', 'devices', 'experience', 'management', 'scalability']","['Mint', 'Sprint', 'TMobile', 'VerizonWireless']",0.3080002,"['Introducing T-Mobile One', ""F Mobile P R E E N T JUSTIN Celebration Expert SAY SAY GOODBYE TO LIMITS at plans if congested top 3 may notice reduced speeds due to x regulatory fees included in mo service price See materials for specifics in your state POST YOUR MOVES F Mobile Pop Hello, I'm Justin Bieber, celebration expert""]","['unlimited', 'taxes', 'fees', 'service']",4
Tide,AD0509,0.0,"LI BURGH E LI Keep out reach children No stain deserves fame by Tide Its to be got FOX COX HA Super l super bowl Li Sui See pow ALERT EXPECT DELAYS Hall of Curt 5 LG Pass Salsa Hall of SACKED BY STAIN Ta sources the to Fol 4 Bradshaw We're back in five. PB, you gotta clean that shirt. Oh, oh, I need a shirt. I know, you're trending. Trending? Here, Terry, take mine. Where's wardrobe? Kevin, I'm trending. I gotta fix this. Bradshaw? We got a Bradshaw on the loose. I gotta stay. Yes! Woo! Hi, it's the same guy. I gotta stay. A source has now confirmed that it was, in fact, barbecue sauce. Who's that? Bradshaw. Hi. You got a, um? The gazelle's migration is an extraordinary sight. Do you think we could probably check out the game? Shh, shh, shh, shh. The search for fresh foliage during the dry season. Hey, Terry? It's not what's on here that counts. It's what's in here. Really? I don't know. Oh, where was I?",0.5586592178770949,[],[],['extraordinary'],['extraordinary'],Household and lawn and garden supplies,"['powerful', 'effective', 'reliable', 'fast-acting', 'efficient', 'eco-friendly', 'natural', 'safe', 'gentle', 'strong', 'tough', 'streak-free', 'odor-free', 'biodegradable', 'non-toxic', 'multi-purpose', 'convenient', 'refreshing', 'long-lasting', 'antibacterial', 'hygienic', 'residue-free', 'lightweight', 'versatile', 'innovative', 'durable', 'concentrated', 'clean', 'sparkling', 'absorbent', 'affordable', 'sustainable', 'easy-to-use', 'flexible', 'compact', 'modern', 'energy-saving', 'weatherproof', 'adaptable', 'seamless', 'precise', 'resilient', 'polished', 'vibrant', 'adjustable', 'ergonomic', 'practical', 'cleanliness', 'power', 'efficiency', 'quality', 'freshness', 'hygiene', 'protection', 'shine', 'performance', 'safety', 'streak-free finish', 'versatility', 'odor control', 'innovation', 'simplicity', 'biodegradability', 'multi-purpose use', 'concentration', 'gentleness', 'eco-friendliness', 'residue', 'effectiveness', 'absorption', 'durability', 'antibacterial action', 'convenience', 'sparkle', 'stain removal', 'solutions', 'foam', 'lather', 'disinfection', 'smell', 'reliability', 'flexibility', 'sustainability', 'strength', 'precision', 'affordability', 'adaptability', 'functionality', 'resilience', 'toughness', 'design', 'aesthetics', 'weather-resistance', 'energy savings', 'usability', 'practicality', 'comfort', 'maintenance', 'tools', 'support', 'stain', 'cleaning power']","['Febreze', 'Loctite', 'MrClean', 'PersilProClean', 'ProcterANDGamble', 'ScottsMiracleGro', 'SpeedStick', 'Tide']",0.1249036,[],"['clean', 'stain']",2
Microsoft,AD0337,0.0,"Alt WE ARE SHAPING HUMAN HISTORY AM PM WHAT IS TECHNOLOGY IT GIVES HOPE TO THE HOPELESS WE CAN Steve Gleason Former NFL player with Dad Living Empowering us all Microsoft empowering windows Up _ C 0 0 0 BM Dion m To 8 Gd Name 0 N M U e Jon Volume TS Iva P program DI Ta Tn 8 f Am DD x one Va Dd 0 E drive Jo i ed G in 4 Name PE F Rive Mt i G e 9 C Add LI R Am 0 Dob Queue drive o h Volume TS iv E Rim C DI D 8 Volume s C Am U 0 d Rio in Dr o Dr 0 Jo 0 Steve Gleason On Technology WHAT CAN It Do Cap TECHNOLOGY HAS THE POWER TO UNITE US What is technology? What can it do? When I lost my eyesight, I thought that my painting days were over. How far can we go? By using your hands, you can actually control your x-ray. Technology has the power to unite us. Hang on, honey. Hang on. There he is. Can you see him? I can see him. It inspires us. Technology has taken us places we've only dreamed. Now I can do whatever I want. It gives hope to the hopeless. You're not that bad. You're really talking bad. And it has given voice to the voiceless.",0.4524886877828055,[],[],['only'],['only'],Consumer Electronics and Appliances,"['Smart', 'Display', 'Control', 'Touchscreen', 'Wireless', 'Innovative', 'Innovation', 'Advanced', 'Reliable', 'Powerful',  'Integration', 'Cloud', 'Compact', 'Adaptive', 'Efficient', 'Customizable', 'Connectivity', 'Features', 'Performance', 'High-performance', 'Processor', 'AI-powered', 'Interactive', 'Premium', 'Cutting-Edge', 'Future-ready', 'Clarity', 'Solution', 'Portable',  'Bluetooth', 'Charging', 'Responsive', 'Sync']","['BlackBerry', 'Google', 'Intel', 'LGEEAudioVisual', 'MetaforMetaQuest', 'Nintendo', 'SamsungCommunicationMedia', 'SodaStream', 'BeatsbyDrDre', 'MONSTERPRODUCTS', 'Logitech', 'MICROSOFT', 'Mophie', 'Microsoft', 'BestBuy', 'RadioShack']",0.16992123,[],['control'],1
Toyota,AD0460,1.0,"8 DANK 8 0 DANK Park BANK TOP STORY DEVELOPING PRIUS CHASE Fictionalization STATE Police ONLY Rt Tu ON THE SCENE CONTINUES STILL IMPROVING HEADLINES DANK PRIUS 4 Pet Ill Co Go Prius Go Go CHASE Prius chase Continues Prius CONTINUES Prius L continues The System Is not substitute for safe and attentive driving practices THE PRIUS PRIUS Lets Go TOYOTA Places Third WAY STOP ST Prototype shown with options Production model may vary Parking PARKING Valet Special with options Production may vary Public Thank VALET Tam Parking 5 1 Professional driver on closed course Do NOT attempt 2 SELF PARK police Oh No the car told you somebody should've waited in the car Since there's a black car three minutes away. Okay, come on Is this a Prius very patient This thing is actually pretty fast over very funny. Oh man, that's a lot of cops Oh Look a farmer's market we should get some flowers for the car Prius folks you can't make this stuff up now the chases at the freeway The scene with the Prius for authority still in pursuit It's a chase that some are calling the chase of the century and is now a global phenomenon What are Prius owners feeling right now proud I feel proud Which of the four are you most attracted to the driver? Fall asleep no, it's meditating",0.45045045045045046,[],[],['ONLY'],['ONLY'],Car Manufacturer,"['Luxurious', 'Efficient', 'Powerful', 'Innovative', 'Strong', 'Spacious',  'Premium', 'Advanced', 'Reliable', 'Dynamic', 'Responsive', 'Safe', 'Robust', 'Easy', 'Transparent', 'Steamlined', 'Worry-free', 'Exceptional', 'Precision', 'Revolutionary', 'Electrifying', 'Hybrid', 'Smart', 'Quiet', 'Fast', 'New', 'Exciting', 'Fuel Efficient', 'Aerodynamic', 'Stylish', 'Durable', 'Versatile',  'Eco-friendly', 'Sustainable', 'Comfortable','Drive', 'Exceed', 'Surpass', 'Outperform',  'Accelerate', 'Control', 'Deliver', 'Optimize', 'Save','Performance', 'Efficiency', 'Power', 'Luxury', 'Precision', 'Technology', 'Room', 'Space', 'Progress', 'Research', 'Help', 'Comfort', 'Durability', 'Handling', 'Responsiveness', 'Safety',  'Aerodynamics', 'Strength', 'Speed', 'Acceleration', 'Torque', 'Engine', 'Midsize', 'Seven-Passenger', 'GPS', 'Emergency Braking', 'Car Finder', 'Pedestrian Detection', 'Remote Start', 'Pricing', 'Stability', 'Control', 'Craftsmanship', 'Reliability', 'Experience', 'Design', 'Miles', 'Snow', 'Snowy', 'Mountain', 'Assurance', 'Exchange', 'Test Drive', 'Innovation', 'Advanced Technology', 'Aerodynamic Design',  'Smart Features', 'Driver Assistance', 'Crash Protection',  'All-Wheel Drive', 'Fuel Economy', 'Electric Powertrain',  'Regenerative Braking', 'Quiet Cabin', 'Premium Interiors',  'Seamless Connectivity', 'Enhanced Suspension', 'LED Headlights']","['Acura', 'AlfaRomeo', 'Audi', 'BMW', 'Buick', 'Cadillac', 'Chevrolet', 'Chrysler', 'Dodge', 'Fiat', 'Ford', 'GeneralMotors', 'Genesis', 'GMC', 'Honda', 'Hyundai', 'Jaguar', 'Jeep', 'Kia', 'Lexus', 'Lincoln', 'Maserati', 'MercedesBenz', 'MINI', 'Nissan', 'Polestar', 'Porsche', 'Ram', 'Toyota']",0.3277244,"[""8 DANK 8 0 DANK Park BANK TOP STORY DEVELOPING PRIUS CHASE Fictionalization STATE Police ONLY Rt Tu ON THE SCENE CONTINUES STILL IMPROVING HEADLINES DANK PRIUS 4 Pet Ill Co Go Prius Go Go CHASE Prius chase Continues Prius CONTINUES Prius L continues The System Is not substitute for safe and attentive driving practices THE PRIUS PRIUS Lets Go TOYOTA Places Third WAY STOP ST Prototype shown with options Production model may vary Parking PARKING Valet Special with options Production may vary Public Thank VALET Tam Parking 5 1 Professional driver on closed course Do NOT attempt 2 SELF PARK police Oh No the car told you somebody should've waited in the car Since there's a black car three minutes away""]","['safe', 'fast']",2
BUBLY,AD0586,1.0,"water sparkling water col Ho Ably Ably DAVE sparkling sparkling blackberry late W no no sweeteners aw hi sparkling water all smiles flavor with other W Le 1 Ooh Ea 1 bob Mole Hart Ooh, Blackberry Bubl, my favorite. You mean Bubbly. No, I mean Bubl. You're Michael Bubl. That's a Bubbly. She's right, Michael Bubl. It's pronounced Bubl. I know, thanks. Davi. Can I have your autograph, Mr. Bubl? It's Bubl. Bubl? It's Bubl! Sparkling water. Crack a smile. Michael, don't do that.",0.0,[],[],[],[],Softdrinks,"['refreshing', 'organic', 'fizzy', 'sparkling', 'light', 'invigorating', 'bubbly', 'natural', 'fruity', 'energizing', 'satisfying', 'tropical', 'fresh', 'delicious', 'revitalizing', 'exotic', 'pure', 'tasty', 'healthy', 'nutritious', 'wholesome', 'flavor', 'taste', 'calories', 'sugar', 'vitamins', 'energy', 'ingredients', 'refreshment', 'aroma', 'sweeteners', 'electrolytes', 'quality']","['Bai', 'BUBLY', 'CocaCola', 'DietCoke', 'MiO', 'MountainDew', 'Pepsi', 'Sprite']",0.5620157,"['water sparkling water col Ho Ably Ably DAVE sparkling sparkling blackberry late W no no sweeteners aw hi sparkling water all smiles flavor with other W Le 1 Ooh Ea 1 bob Mole Hart Ooh, Blackberry Bubl, my favorite', ""Bubl? It's Bubl! Sparkling water"", 'You mean Bubbly']","['sparkling', 'flavor', 'sweeteners']",3
Bai,AD0475,0.0,"ANTIOXIDANT INFUSION 5 Artificial Sweeteners and Tastes Amazing I don't want to make it tough. I just want to tell you that I've had enough. It might sound crazy, but it ain't no lie, baby. Bye, bye, bye. Bye, bye, bye. Bye, bye, bye. Five calories, no artificial sweeteners, and tastes amazing. Bye.",0.0,[],[],[],[],Softdrinks,"['refreshing', 'organic', 'fizzy', 'sparkling', 'light', 'invigorating', 'bubbly', 'natural', 'fruity', 'energizing', 'satisfying', 'tropical', 'fresh', 'delicious', 'revitalizing', 'exotic', 'pure', 'tasty', 'healthy', 'nutritious', 'wholesome', 'flavor', 'taste', 'calories', 'sugar', 'vitamins', 'energy', 'ingredients', 'refreshment', 'aroma', 'sweeteners', 'electrolytes', 'quality']","['Bai', 'BUBLY', 'CocaCola', 'DietCoke', 'MiO', 'MountainDew', 'Pepsi', 'Sprite']",0.4962689,"['Five calories, no artificial sweeteners, and tastes amazing', ""ANTIOXIDANT INFUSION 5 Artificial Sweeteners and Tastes Amazing I don't want to make it tough""]",['sweeteners'],1
Cheerios,AD0323,0.0,"No up Me Love Hey, Gracie. You know how our family has daddy and mommy? And me. Yeah, that's right. Pretty soon, you're going to have a baby brother. And a puppy. Deal.",0.0,[],[],[],[],Snacks,"['artificial', 'zero', 'refreshing', 'organic', 'crispy', 'crunchy', 'delicious', 'tasty', 'satisfying', 'flavorful', 'fresh', 'spicy', 'hot', 'light', 'creamy', 'natural', 'handcrafted', 'baked', 'roasted', 'smoky', 'glazed', 'irresistible', 'convenient', 'healthy', 'nutritious', 'wholesome', 'new','calories', 'carbs', 'fat', 'flavor', 'sugar', 'quality', 'protein', 'taste', 'ingredients', 'nutrients', 'energy', 'texture', 'crunch', 'aroma', 'variety', 'balance', 'recipe', 'fiber', 'vitamins', 'minerals', 'packaging', 'satisfaction', 'indulgence', 'convenience', 'seasoning', 'coating', 'filling', 'topping', 'ranch', '3D']","['Butterfinger', 'Cheerios', 'Cheetos', 'Chobani', 'Dannon', 'DEVOUR', 'Doritos', 'Heinz', 'HellmannsMayonnaise', 'KingsHawaiian', 'Kraft', 'Lays', 'MANDMs', 'Nestle', 'Oreo', 'Planters', 'Poptarts', 'Pringles', 'Reeses', 'SabraHummus', 'Skittles', 'Snickers', 'WonderfulPistachios']",0.030518541,[],[],0
Cheetos,AD0638,0.0,"CHEDDAR CHEDDAR Cob Te _ US Tans All Owed by Cheetos has popcorn now? Hey, I'm gonna need you to... Never mind. You can't touch this. Help me. You can't touch this. You can't touch this. You can't touch this. I trust you. Stop. Hammer time. I touched it. New Cheetos popcorn. It's a Cheetos thing.",0.0,[],[],[],[],Snacks,"['artificial', 'zero', 'refreshing', 'organic', 'crispy', 'crunchy', 'delicious', 'tasty', 'satisfying', 'flavorful', 'fresh', 'spicy', 'hot', 'light', 'creamy', 'natural', 'handcrafted', 'baked', 'roasted', 'smoky', 'glazed', 'irresistible', 'convenient', 'healthy', 'nutritious', 'wholesome', 'new','calories', 'carbs', 'fat', 'flavor', 'sugar', 'quality', 'protein', 'taste', 'ingredients', 'nutrients', 'energy', 'texture', 'crunch', 'aroma', 'variety', 'balance', 'recipe', 'fiber', 'vitamins', 'minerals', 'packaging', 'satisfaction', 'indulgence', 'convenience', 'seasoning', 'coating', 'filling', 'topping', 'ranch', '3D']","['Butterfinger', 'Cheerios', 'Cheetos', 'Chobani', 'Dannon', 'DEVOUR', 'Doritos', 'Heinz', 'HellmannsMayonnaise', 'KingsHawaiian', 'Kraft', 'Lays', 'MANDMs', 'Nestle', 'Oreo', 'Planters', 'Poptarts', 'Pringles', 'Reeses', 'SabraHummus', 'Skittles', 'Snickers', 'WonderfulPistachios']",0.31237862,"['New Cheetos popcorn', ""CHEDDAR CHEDDAR Cob Te _ US Tans All Owed by Cheetos has popcorn now? Hey, I'm gonna need you to""]",['new'],1
CocaCola,AD0264,0.0,Do not Ia MILES ES Vote now to decide who wins COM ca Cd Cc a h N u Me U Cola are Ea of Cola PF Pf AC Welcome to the The The The The The The The The The The The The The The The The The The The The The The The The The The The The The The The The The The The The The The The The The The The The The The The The The The The The The The The The The The The The The The The The The The The The The The The The The The The The The The The The The The,0.0,[],[],[],[],Softdrinks,"['refreshing', 'organic', 'fizzy', 'sparkling', 'light', 'invigorating', 'bubbly', 'natural', 'fruity', 'energizing', 'satisfying', 'tropical', 'fresh', 'delicious', 'revitalizing', 'exotic', 'pure', 'tasty', 'healthy', 'nutritious', 'wholesome', 'flavor', 'taste', 'calories', 'sugar', 'vitamins', 'energy', 'ingredients', 'refreshment', 'aroma', 'sweeteners', 'electrolytes', 'quality']","['Bai', 'BUBLY', 'CocaCola', 'DietCoke', 'MiO', 'MountainDew', 'Pepsi', 'Sprite']",0.05822018,[],[],0
CocaCola,AD0265,0.0,SECURITY CAMERAS AROUND THE WORLD ALSO CAPTURE PEOPLE STEALING MUSIC HONEST S C AND CH EA ATTACKS F FRIENDSHIP UNEXPECTED AND PEACEFUL LETS LOOK AT THE WORLD A LITTLE DIFFERENTLY Coke Open Happiness and the Contour Bottle Design are registered trademarks of the Coca Cola Company LETS LOOK AT THE WORLD A LITTLE DIFFERENTLY e happiness ,0.0,[],[],[],[],Softdrinks,"['refreshing', 'organic', 'fizzy', 'sparkling', 'light', 'invigorating', 'bubbly', 'natural', 'fruity', 'energizing', 'satisfying', 'tropical', 'fresh', 'delicious', 'revitalizing', 'exotic', 'pure', 'tasty', 'healthy', 'nutritious', 'wholesome', 'flavor', 'taste', 'calories', 'sugar', 'vitamins', 'energy', 'ingredients', 'refreshment', 'aroma', 'sweeteners', 'electrolytes', 'quality']","['Bai', 'BUBLY', 'CocaCola', 'DietCoke', 'MiO', 'MountainDew', 'Pepsi', 'Sprite']",0.18478534,[],[],0
CocaCola,AD0316,0.0,"Top DRIVE AT K 4 Ln Fa E 4 Coke Open Contour are registered trademarks of Company EAT EAT Li   Oh beautiful for spacious skies   Por tus olas de granos ambar   Yo piscina sacudin   Soy pabana manga brutas   America, America   God shed his grace on thee   Orba y jere que sarta enste racha   La mera, la mera brilla   Bega tu verga y te gozar   From sea to shining sea ",0.0,[],[],[],[],Softdrinks,"['refreshing', 'organic', 'fizzy', 'sparkling', 'light', 'invigorating', 'bubbly', 'natural', 'fruity', 'energizing', 'satisfying', 'tropical', 'fresh', 'delicious', 'revitalizing', 'exotic', 'pure', 'tasty', 'healthy', 'nutritious', 'wholesome', 'flavor', 'taste', 'calories', 'sugar', 'vitamins', 'energy', 'ingredients', 'refreshment', 'aroma', 'sweeteners', 'electrolytes', 'quality']","['Bai', 'BUBLY', 'CocaCola', 'DietCoke', 'MiO', 'MountainDew', 'Pepsi', 'Sprite']",0.20136705,[],[],0
CocaCola,AD0317,0.0,"PASS TC WIN CA LA L Cor ad Bu Bu 4 CO Ll ct zero 1 open 0 9 Go 1 HOME DOWN NT Let's go, Adrian. Adrian, let's go. Get out there in the field. Let's go. Hey, helmet. Let's go. 34 pinch. Cover two. Don't mess this up again, Adrian. Ready? Break. Set. Fight. Run. All the way, Adrian. Cuts right. Cuts left. He's flying. He cuts back. Players of the ages. Yeah. Coming through. One man to beat. That's how we do it. Let's go. Yeah. Hey, kid. Here.",0.0,[],[],[],[],Softdrinks,"['refreshing', 'organic', 'fizzy', 'sparkling', 'light', 'invigorating', 'bubbly', 'natural', 'fruity', 'energizing', 'satisfying', 'tropical', 'fresh', 'delicious', 'revitalizing', 'exotic', 'pure', 'tasty', 'healthy', 'nutritious', 'wholesome', 'flavor', 'taste', 'calories', 'sugar', 'vitamins', 'energy', 'ingredients', 'refreshment', 'aroma', 'sweeteners', 'electrolytes', 'quality']","['Bai', 'BUBLY', 'CocaCola', 'DietCoke', 'MiO', 'MountainDew', 'Pepsi', 'Sprite']",0.007044051,[],[],0
CocaCola,AD0364,0.0,HAT gets happy hut MO p AA We COT THIS SALON THIS GOT Share Bird James Gillespie Devin now one just No likes Comment Biro _ Bird James Gillespie Devin now one no like Comments The world is what we make it w cal pule 3 FREAK Then INTERNET SERVER an T What an incredibly parent Hour ago hate u hate u 1 reply Th 2 mole comments ca Jo gets violent Ma News Interview interview gets violent gets violent Though I may make mistakes Don't let me show ugliness Though I know I can't hate And don't let me show evil Though it might be all I've got Show me love Show me love Show me love,0.0,[],[],[],[],Softdrinks,"['refreshing', 'organic', 'fizzy', 'sparkling', 'light', 'invigorating', 'bubbly', 'natural', 'fruity', 'energizing', 'satisfying', 'tropical', 'fresh', 'delicious', 'revitalizing', 'exotic', 'pure', 'tasty', 'healthy', 'nutritious', 'wholesome', 'flavor', 'taste', 'calories', 'sugar', 'vitamins', 'energy', 'ingredients', 'refreshment', 'aroma', 'sweeteners', 'electrolytes', 'quality']","['Bai', 'BUBLY', 'CocaCola', 'DietCoke', 'MiO', 'MountainDew', 'Pepsi', 'Sprite']",0.057949495,[],[],0
CocaCola,AD0480,0.0,zero Ra AND FOOD CLASSIC LOVE STORY s of The Company TASTE THE FEELING The Feeling are trademarks Ice ,0.0,[],[],[],[],Softdrinks,"['refreshing', 'organic', 'fizzy', 'sparkling', 'light', 'invigorating', 'bubbly', 'natural', 'fruity', 'energizing', 'satisfying', 'tropical', 'fresh', 'delicious', 'revitalizing', 'exotic', 'pure', 'tasty', 'healthy', 'nutritious', 'wholesome', 'flavor', 'taste', 'calories', 'sugar', 'vitamins', 'energy', 'ingredients', 'refreshment', 'aroma', 'sweeteners', 'electrolytes', 'quality']","['Bai', 'BUBLY', 'CocaCola', 'DietCoke', 'MiO', 'MountainDew', 'Pepsi', 'Sprite']",0.2612607,[],['taste'],1
