brand,commercial_number,BDM,transcript,total_bdm_terms_pct,comparatives,superlatives,unique_words,bdm_words,product_cat_name,product_cat_keywords,product_cat_brands,keyword_similarity,similar_phrases,shared_keywords,shared_keywords_count
PersilProclean,AD0503,0.0,"and t Wine and on Ta Wine and Grape on D on conditions eaten conditions Dimensions NOT CLEAN Original It's working. If my calculations are correct... There goes another lab coat. Ah, Bill. Need a hand? Percil's new and improved formula delivers ten dimensions of clean. Looks clean, feels clean, smells clean. And that science guy is ten dimensions of clean. Ooh! Ten dimensions? Like, parallel dimensions. Yes. Only cleaner. It's not just clean. It's Percil ProClean.",3.896103896103896,['cleaner'],[],"['Original', 'Only']","['Original', 'Only', 'cleaner']",Household and lawn and garden supplies,"['powerful', 'effective', 'reliable', 'fast-acting', 'efficient', 'eco-friendly', 'natural', 'safe', 'gentle', 'strong', 'tough', 'streak-free', 'odor-free', 'biodegradable', 'non-toxic', 'multi-purpose', 'convenient', 'refreshing', 'long-lasting', 'antibacterial', 'hygienic', 'residue-free', 'lightweight', 'versatile', 'innovative', 'durable', 'concentrated', 'clean', 'sparkling', 'absorbent', 'affordable', 'sustainable', 'easy-to-use', 'flexible', 'compact', 'modern', 'energy-saving', 'weatherproof', 'adaptable', 'seamless', 'precise', 'resilient', 'polished', 'vibrant', 'adjustable', 'ergonomic', 'practical', 'cleanliness', 'power', 'efficiency', 'quality', 'freshness', 'hygiene', 'protection', 'shine', 'performance', 'safety', 'streak-free finish', 'versatility', 'odor control', 'innovation', 'simplicity', 'biodegradability', 'multi-purpose use', 'concentration', 'gentleness', 'eco-friendliness', 'residue', 'effectiveness', 'absorption', 'durability', 'antibacterial action', 'convenience', 'sparkle', 'stain removal', 'solutions', 'foam', 'lather', 'disinfection', 'smell', 'reliability', 'flexibility', 'sustainability', 'strength', 'precision', 'affordability', 'adaptability', 'functionality', 'resilience', 'toughness', 'design', 'aesthetics', 'weather-resistance', 'energy savings', 'usability', 'practicality', 'comfort', 'maintenance', 'tools', 'support', 'stain', 'cleaning power']","['Febreze', 'Loctite', 'MrClean', 'PersilProClean', 'ProcterANDGamble', 'ScottsMiracleGro', 'SpeedStick', 'Tide']",0.3018099,"['Looks clean, feels clean, smells clean', 'Only cleaner', ""It's not just clean""]",['clean'],1
Jaguar,AD0332,0.0,"JAGUAR a MORE MOPE speed Le Have you ever noticed how in Hollywood movies all the villains are played by Brits? Maybe we just sound right. Good evening, sir. Thank you, Mary. We're more focused. More precise. We're always one step ahead. With a certain style. An eye for detail. And we're obsessed by power. And we're obsessed by power. Stiff upper lip is key. And we all drive Jaguars. Oh, yes. It's good to be bad.",1.2987012987012987,['MORE'],[],[],['MORE'],Car Manufacturer,"['Luxurious', 'Efficient', 'Powerful', 'Innovative', 'Strong', 'Spacious',  'Premium', 'Advanced', 'Reliable', 'Dynamic', 'Responsive', 'Safe', 'Robust', 'Easy', 'Transparent', 'Steamlined', 'Worry-free', 'Exceptional', 'Precision', 'Revolutionary', 'Electrifying', 'Hybrid', 'Smart', 'Quiet', 'Fast', 'New', 'Exciting', 'Fuel Efficient', 'Aerodynamic', 'Stylish', 'Durable', 'Versatile',  'Eco-friendly', 'Sustainable', 'Comfortable','Drive', 'Exceed', 'Surpass', 'Outperform',  'Accelerate', 'Control', 'Deliver', 'Optimize', 'Save','Performance', 'Efficiency', 'Power', 'Luxury', 'Precision', 'Technology', 'Room', 'Space', 'Progress', 'Research', 'Help', 'Comfort', 'Durability', 'Handling', 'Responsiveness', 'Safety',  'Aerodynamics', 'Strength', 'Speed', 'Acceleration', 'Torque', 'Engine', 'Midsize', 'Seven-Passenger', 'GPS', 'Emergency Braking', 'Car Finder', 'Pedestrian Detection', 'Remote Start', 'Pricing', 'Stability', 'Control', 'Craftsmanship', 'Reliability', 'Experience', 'Design', 'Miles', 'Snow', 'Snowy', 'Mountain', 'Assurance', 'Exchange', 'Test Drive', 'Innovation', 'Advanced Technology', 'Aerodynamic Design',  'Smart Features', 'Driver Assistance', 'Crash Protection',  'All-Wheel Drive', 'Fuel Economy', 'Electric Powertrain',  'Regenerative Braking', 'Quiet Cabin', 'Premium Interiors',  'Seamless Connectivity', 'Enhanced Suspension', 'LED Headlights']","['Acura', 'AlfaRomeo', 'Audi', 'BMW', 'Buick', 'Cadillac', 'Chevrolet', 'Chrysler', 'Dodge', 'Fiat', 'Ford', 'GeneralMotors', 'Genesis', 'GMC', 'Honda', 'Hyundai', 'Jaguar', 'Jeep', 'Kia', 'Lexus', 'Lincoln', 'Maserati', 'MercedesBenz', 'MINI', 'Nissan', 'Polestar', 'Porsche', 'Ram', 'Toyota']",0.27582577,[],"['drive', 'speed']",2
Tide,AD0732,0.0,"LEGENDARY LAKE Keep out of reach of children Its dirtier than it looks New HYGIENIC CLEAN POWER PODS HEAVY Try ta TO M 1 8 1 9 1 1 1 0 I a 0 1 Hey, you have to wash Chase an Alexander hoodie. It looks clean to me. Is it, though? Be sure to get the bugs off the window. You owe Chase an Alexander hoodie an apology. Hey, that's my face. You can't just wear my face. My mom told me to say I'm sorry. Give me back my face.",1.2195121951219512,['dirtier'],[],[],['dirtier'],Household and lawn and garden supplies,"['powerful', 'effective', 'reliable', 'fast-acting', 'efficient', 'eco-friendly', 'natural', 'safe', 'gentle', 'strong', 'tough', 'streak-free', 'odor-free', 'biodegradable', 'non-toxic', 'multi-purpose', 'convenient', 'refreshing', 'long-lasting', 'antibacterial', 'hygienic', 'residue-free', 'lightweight', 'versatile', 'innovative', 'durable', 'concentrated', 'clean', 'sparkling', 'absorbent', 'affordable', 'sustainable', 'easy-to-use', 'flexible', 'compact', 'modern', 'energy-saving', 'weatherproof', 'adaptable', 'seamless', 'precise', 'resilient', 'polished', 'vibrant', 'adjustable', 'ergonomic', 'practical', 'cleanliness', 'power', 'efficiency', 'quality', 'freshness', 'hygiene', 'protection', 'shine', 'performance', 'safety', 'streak-free finish', 'versatility', 'odor control', 'innovation', 'simplicity', 'biodegradability', 'multi-purpose use', 'concentration', 'gentleness', 'eco-friendliness', 'residue', 'effectiveness', 'absorption', 'durability', 'antibacterial action', 'convenience', 'sparkle', 'stain removal', 'solutions', 'foam', 'lather', 'disinfection', 'smell', 'reliability', 'flexibility', 'sustainability', 'strength', 'precision', 'affordability', 'adaptability', 'functionality', 'resilience', 'toughness', 'design', 'aesthetics', 'weather-resistance', 'energy savings', 'usability', 'practicality', 'comfort', 'maintenance', 'tools', 'support', 'stain', 'cleaning power']","['Febreze', 'Loctite', 'MrClean', 'PersilProClean', 'ProcterANDGamble', 'ScottsMiracleGro', 'SpeedStick', 'Tide']",0.2789815,"['LEGENDARY LAKE Keep out of reach of children Its dirtier than it looks New HYGIENIC CLEAN POWER PODS HEAVY Try ta TO M 1 8 1 9 1 1 1 0 I a 0 1 Hey, you have to wash Chase an Alexander hoodie']","['hygienic', 'clean', 'power']",3
Honda,AD0328,1.0,"Honda builds more safety rated cars in America than any other brand on TOP SAFETY PICK ratings as of bY brand for es assembled in Slates Honda are both domestic globally sourced parts top HONDA The Power of Dreams Great game, right? So you're probably expecting me to crash your car or blow something up. But really, I'm here to talk about car safety. Look around you. Who do you see? Friends, family, neighbors, all your loved ones. Everyone you care about. Here's what I want you to do. I want you to give each and every one of them a hug. I'll wait. I'll wait. Thank you. Those people you just hugged, they're real. They're not crash test dummies. They're not engineering data. And their safety matters as much to Honda as it matters to you. And it's why Honda builds more top safety rated cars in America than any other brand. You can let go now, Fred. Honda. The power of dreams. Honda.",1.2121212121212122,"['more', 'more']",[],[],"['more', 'more']",Car Manufacturer,"['Luxurious', 'Efficient', 'Powerful', 'Innovative', 'Strong', 'Spacious',  'Premium', 'Advanced', 'Reliable', 'Dynamic', 'Responsive', 'Safe', 'Robust', 'Easy', 'Transparent', 'Steamlined', 'Worry-free', 'Exceptional', 'Precision', 'Revolutionary', 'Electrifying', 'Hybrid', 'Smart', 'Quiet', 'Fast', 'New', 'Exciting', 'Fuel Efficient', 'Aerodynamic', 'Stylish', 'Durable', 'Versatile',  'Eco-friendly', 'Sustainable', 'Comfortable','Drive', 'Exceed', 'Surpass', 'Outperform',  'Accelerate', 'Control', 'Deliver', 'Optimize', 'Save','Performance', 'Efficiency', 'Power', 'Luxury', 'Precision', 'Technology', 'Room', 'Space', 'Progress', 'Research', 'Help', 'Comfort', 'Durability', 'Handling', 'Responsiveness', 'Safety',  'Aerodynamics', 'Strength', 'Speed', 'Acceleration', 'Torque', 'Engine', 'Midsize', 'Seven-Passenger', 'GPS', 'Emergency Braking', 'Car Finder', 'Pedestrian Detection', 'Remote Start', 'Pricing', 'Stability', 'Control', 'Craftsmanship', 'Reliability', 'Experience', 'Design', 'Miles', 'Snow', 'Snowy', 'Mountain', 'Assurance', 'Exchange', 'Test Drive', 'Innovation', 'Advanced Technology', 'Aerodynamic Design',  'Smart Features', 'Driver Assistance', 'Crash Protection',  'All-Wheel Drive', 'Fuel Economy', 'Electric Powertrain',  'Regenerative Braking', 'Quiet Cabin', 'Premium Interiors',  'Seamless Connectivity', 'Enhanced Suspension', 'LED Headlights']","['Acura', 'AlfaRomeo', 'Audi', 'BMW', 'Buick', 'Cadillac', 'Chevrolet', 'Chrysler', 'Dodge', 'Fiat', 'Ford', 'GeneralMotors', 'Genesis', 'GMC', 'Honda', 'Hyundai', 'Jaguar', 'Jeep', 'Kia', 'Lexus', 'Lincoln', 'Maserati', 'MercedesBenz', 'MINI', 'Nissan', 'Polestar', 'Porsche', 'Ram', 'Toyota']",0.3877773,"['Honda', 'Honda', ""Honda builds more safety rated cars in America than any other brand on TOP SAFETY PICK ratings as of bY brand for es assembled in Slates Honda are both domestic globally sourced parts top HONDA The Power of Dreams Great game, right? So you're probably expecting me to crash your car or blow something up""]","['power', 'safety']",2
Febreze,AD0535,0.0,"WREST Feb Dave at your Super Bowl party But everyone else iS Is your bathroom ready AIR I'm Dave and my bleep don't stink. Well for a boy whose bleep don't stink Dave turned out to be a very well adjusted adult. Good kid Bleep don't stink. Well, we first noticed it at his first birthday Nothing. I miss Dave. My friend her son's a lawyer, but my son his bleep don't stink so That's better than being a lawyer Mom what is Febreze?",3.571428571428571,['better'],[],"['first', 'first']","['first', 'first', 'better']",Household and lawn and garden supplies,"['powerful', 'effective', 'reliable', 'fast-acting', 'efficient', 'eco-friendly', 'natural', 'safe', 'gentle', 'strong', 'tough', 'streak-free', 'odor-free', 'biodegradable', 'non-toxic', 'multi-purpose', 'convenient', 'refreshing', 'long-lasting', 'antibacterial', 'hygienic', 'residue-free', 'lightweight', 'versatile', 'innovative', 'durable', 'concentrated', 'clean', 'sparkling', 'absorbent', 'affordable', 'sustainable', 'easy-to-use', 'flexible', 'compact', 'modern', 'energy-saving', 'weatherproof', 'adaptable', 'seamless', 'precise', 'resilient', 'polished', 'vibrant', 'adjustable', 'ergonomic', 'practical', 'cleanliness', 'power', 'efficiency', 'quality', 'freshness', 'hygiene', 'protection', 'shine', 'performance', 'safety', 'streak-free finish', 'versatility', 'odor control', 'innovation', 'simplicity', 'biodegradability', 'multi-purpose use', 'concentration', 'gentleness', 'eco-friendliness', 'residue', 'effectiveness', 'absorption', 'durability', 'antibacterial action', 'convenience', 'sparkle', 'stain removal', 'solutions', 'foam', 'lather', 'disinfection', 'smell', 'reliability', 'flexibility', 'sustainability', 'strength', 'precision', 'affordability', 'adaptability', 'functionality', 'resilience', 'toughness', 'design', 'aesthetics', 'weather-resistance', 'energy savings', 'usability', 'practicality', 'comfort', 'maintenance', 'tools', 'support', 'stain', 'cleaning power']","['Febreze', 'Loctite', 'MrClean', 'PersilProClean', 'ProcterANDGamble', 'ScottsMiracleGro', 'SpeedStick', 'Tide']",0.13364927,[],[],0
Budweiser,AD0361,0.0,"CL RESPONSIBLY Busch BEER St Lours MO M ROYAL Royal CST DOG DO When I wake up, well I know I'm gonna be, I'm gonna be the man who wakes up next to you. And when I go out, yeah I know I'm gonna be, I'm gonna be the man who goes along with you. I will walk five hundred miles, and I will walk five hundred more, just to be in the middle of the thousand miles, to fall down at your door.",1.1363636363636365,['more'],[],[],['more'],Alcoholic beverages (Beer Hard Seltzer),"['smooth', 'rich', 'refreshing', 'aromatic', 'flavorful', 'delicious', 'natural', 'zero', 'complex', 'premium', 'crafted', 'balanced', 'full-bodied', 'organic', 'fit', 'artificial','flavor', 'aroma', 'ingredients', 'quality', 'finish', 'character', 'craftsmanship', 'texture', 'heritage', 'blend', 'notes','bouquet', 'smoothness', 'intensity', 'purity', 'richness', 'tradition', 'complexity', 'corn syrup', 'cals', 'calories', 'carbs', 'protein', 'fat', 'sugar']","['Anheuser Busch InBev', 'Becks Beer', 'Bud Light', 'Budweiser', 'Busch', 'Michelob ULTRA', 'Shock Top', 'Stella Artois', 'BonViv', 'Bud Light Seltzer', 'Cutwater Spirits''Shock Top', 'Stella Artois', 'BonViv', 'Bud Light Seltzer', 'Cutwater Spirits']",0.16998886,[],[],0
AmericanFamilyInsurance,AD0301,0.0,"YOUR DREAM IS OUT THERE GO GET IT AMERICAN FAMILY WELL PROTECT IT AMERICAN FAMILY INSURANCE W Lo 4 L Lo There's nothing stronger or more powerful than a dream. Even in darkness, dreams have an infinite capacity to see light. They outlive pain. They outlast heartbreak. They overcome doubt. They forget imperfection. They cannot be beaten, broken, or taken. Dreams fight. They persevere. They go on. Because determination will always trump disappointment. Desire will always triumph over defeat. And dreams, dreams will always prevail.  BF-WATCH TV 2021",1.1363636363636365,['stronger'],[],[],['stronger'],Insurance,"['reliable', 'affordable', 'comprehensive', 'secure', 'flexible', 'trusted', 'accessible', 'dependable', 'innovative', 'personalized', 'tailored', 'simple', 'efficient', 'inclusive', 'responsive', 'transparent', 'strong', 'robust', 'stable', 'convenient', 'empowering', 'seamless', 'professional', 'supportive', 'protective', 'adaptable', 'easy-to-use', 'customer-focused', 'risk-free', 'valuable', 'proactive', 'fast', 'dynamic', 'effective', 'sustainable', 'trustworthy', 'empowering', 'essential', 'cost-effective', 'protection', 'security', 'coverage', 'trust', 'reliability', 'affordability', 'flexibility', 'stability', 'accessibility', 'efficiency', 'confidence', 'safety', 'support', 'value', 'care', 'assistance', 'solutions', 'innovation', 'customer service', 'risk management', 'financial stability', 'transparency', 'customization', 'policies', 'options', 'dependability', 'claims', 'adaptability', 'peace', 'assurance', 'comfort', 'recovery', 'strength', 'planning', 'reliability', 'care', 'control', 'responsiveness', 'commitment', 'opportunitiy', 'opportunities', 'expert']","['AmericanFamilyInsurance', 'Esurance', 'Geico', 'NationwideInsurance', 'NewYorkLife', 'StateFarm']",0.19349653,[],[],0
TurboTax,AD0571,0.0,"simulated Actual connection times may vary Tax prep varies by individual Feature varies by product and platform Intuit tax experts include and Maximum Refund CPA Maximum Refund CPA intuit NEW Sometimes we imagine things far worse than they truly are. But we take a deep breath and we do our taxes with TurboTax. Now a CPA can review your return with you. Am I getting a maximum refund? I checked it, ma'am. You're good to go. See? Nothing to be afraid of at all. Oh, shit. Hello? Intuit TurboTax.",1.1363636363636365,['worse'],[],[],['worse'],Banking & Investments,"['secure', 'reliable', 'customized', 'personalized', 'easy', 'quick', 'convenient', 'safe', 'simple', 'comfortable', 'helpful', 'smart', 'trusted', 'innovative', 'efficient',  'trust', 'growth', 'savings', 'opportunities', 'returns', 'portfolio', 'strategy', 'innovation', 'convenience', 'expertise', 'performance', 'risk management', 'efficiency', 'mortgage', 'loan', 'confidence', 'credit', 'future', 'time', 'refund', 'expenses', 'reimbursement', 'on demand', 'fees', 'comfort', 'help', 'support', 'experts', 'advice', 'cpa', 'payments', 'interest', 'confidence',  'save', 'diversify', 'grow']","['BankofAmerica', 'Coinbase', 'Cryptocom', 'Discover', 'eToro', 'ETRADE', 'EXPENSIFY', 'FTX', 'Greenlight', 'GuaranteedRate', 'Intuit', 'Klarna', 'PayPal', 'QuickenLoans', 'Robinhood', 'RocketHomesAndRocketMortgage', 'ROCKETMORTGAGE', 'SoFi', 'SunTrust', 'TurboTax', 'HANDRBlock', 'TurboTax', 'Intuit', 'Rakuten']",0.29244986,"['Now a CPA can review your return with you', 'simulated Actual connection times may vary Tax prep varies by individual Feature varies by product and platform Intuit tax experts include and Maximum Refund CPA Maximum Refund CPA intuit NEW Sometimes we imagine things far worse than they truly are']","['refund', 'experts', 'cpa']",3
MachineZone,AD0381,0.0,"GAME OF WAR REF R G M a are Marc Play t Malt PLAY GAME FREE WAR NOW App Store amazon Seek Not Zone Inc and Game Age logo Zone In and Marks and Play are Google Inc Al other Are property The thing about empires, the bigger you build them, the more your enemies want to knock them down. Let them have their fun. You and I will revisit them soon enough. Do you want to come and play? Game of War. Play for free now from the App Store.",1.098901098901099,['bigger'],[],[],['bigger'],Games,"['Free', 'Exclusive', 'Unlimited', 'Anywhere', 'Seamless', 'Fun', 'Exciting', 'Engaging', 'Action', 'Realistic', 'Entertaining', 'Entertainment', 'Strategic', 'Epic', 'Endless', 'Accessible', 'Instant', 'High-quality', 'Optimized',  'Interactive', 'Innovative', 'Immersive', 'Customizable',  'Fast', 'Smooth', 'Flexible', 'Global', 'Connected', 'Graphics', 'High-definition', 'HD', 'Ultra', 'Competition', 'Characters', 'World', 'Explore', 'Achive', 'Prgogress', 'Rewards', 'Multiplayer', 'Features', 'Social', 'Competitive', 'Rewarding', 'Level', 'Points', 'Score', 'Team', 'Mode', 'Challenge', 'Win', 'Mission', 'Goal', 'Arena', 'Battle', 'Adventure', 'Quest', 'Strategy', 'Skill']","['MachineZone', 'MobileStrike', 'Pokemon', 'Supercell', 'TopGamesUS', 'uCool', 'Wargaming']",0.39165983,"['Do you want to come and play? Game of War', 'GAME OF WAR REF R G M a are Marc Play t Malt PLAY GAME FREE WAR NOW App Store amazon Seek Not Zone Inc and Game Age logo Zone In and Marks and Play are Google Inc Al other Are property The thing about empires, the bigger you build them, the more your enemies want to knock them down', 'Play for free now from the App Store']",['free'],1
DisneyPlus,AD0697,0.0,"s s _ Places Mas HAS SOMETHING _ 4 F 4 _ INCREDIBLE GREAT THE z UNFORGETTABLE CHARACTERS ORIGINAL S TALE SOLAR OPPOSITES LITTLE FIRES EVERYWHERE UNSTOPPABLE ICONS la La 3 0 FOR 3 0 LIBRARY This MOMENT FOR FOR LIVE ALL OF THESE AND MORE NOW STREAMING THE DISNEY BUNDLE ONLY Includes Access content from each service separately Disney and its related entities Woohoo! I wish to show you something. I'm ready to go. Oh, this is gonna be a gas! Here we go. Woo! Look at us, we're ballers. I love it. Huzzah! Cheers. This is the way.",3.260869565217391,['MORE'],[],"['ORIGINAL', 'ONLY']","['ORIGINAL', 'MORE', 'ONLY']",Streaming Service ,"['innovative', 'seamless', 'immersive', 'exclusive', 'unlimited', 'reliable', 'flexible', 'intuitive', 'accessible', 'customizable', 'personalized', 'dynamic', 'on-demand', 'fast', 'high-quality', 'affordable', 'interactive', 'versatile', 'entertaining', 'user-friendly', 'engaging', 'responsive', 'modern', 'secure', 'inclusive', 'global', 'premium', 'effortless', 'adaptive', 'diverse', 'compact', 'efficient', 'streamlined', 'flexible', 'engrossing', 'vivid', 'captivating', 'favorite', 'convenient','streaming', 'entertainment', 'content', 'quality', 'selection', 'library', 'experience', 'access', 'versatility', 'subscriptions', 'originals', 'variety', 'features', 'playback', 'binge-watching', 'exclusivity', 'freedom', 'availability', 'platform', 'choices', 'genres', 'recommendations', 'episodes', 'shows', 'movies', 'streamline', 'series', 'innovations', 'audiences', 'subscriptions', 'convenience', 'technology', 'resolution', 'curation', 'analytics', 'playlists', 'viewing', 'downloads', 'ease']","['AmazonPrimeVideo', 'DisneyPlus', 'Hulu', 'Paramount Plus', 'Quibi', 'YouTube']",0.43243462,['s s _ Places Mas HAS SOMETHING _ 4 F 4 _ INCREDIBLE GREAT THE z UNFORGETTABLE CHARACTERS ORIGINAL S TALE SOLAR OPPOSITES LITTLE FIRES EVERYWHERE UNSTOPPABLE ICONS la La 3 0 FOR 3 0 LIBRARY This MOMENT FOR FOR LIVE ALL OF THESE AND MORE NOW STREAMING THE DISNEY BUNDLE ONLY Includes Access content from each service separately Disney and its related entities Woohoo! I wish to show you something'],"['streaming', 'content', 'library', 'access']",4
Budweiser,AD0591,1.0,"WIND NEVER FELT BETTER NOW BREWED WITH WIND POWER tore NOW BREWED WITH WIND POWER ELECTRICITY FROM WIND POWER IS ONE TYPE OF ENERGY WE USE TO BREW LEARN MORE AT BUDWEISER COM THIS BUDS FOR A BETTER TOMORROW Se How many roads must a man walk down before you call him a man? How many seas must the white dove sail before she sleeps in the sand? Yes, and how many times must the cannonballs fly before they're forever banned? The answer, my friend, is blowing in the wind. The answer is blowing in the wind.",1.0309278350515463,['MORE'],[],[],['MORE'],Alcoholic beverages (Beer Hard Seltzer),"['smooth', 'rich', 'refreshing', 'aromatic', 'flavorful', 'delicious', 'natural', 'zero', 'complex', 'premium', 'crafted', 'balanced', 'full-bodied', 'organic', 'fit', 'artificial','flavor', 'aroma', 'ingredients', 'quality', 'finish', 'character', 'craftsmanship', 'texture', 'heritage', 'blend', 'notes','bouquet', 'smoothness', 'intensity', 'purity', 'richness', 'tradition', 'complexity', 'corn syrup', 'cals', 'calories', 'carbs', 'protein', 'fat', 'sugar']","['Anheuser Busch InBev', 'Becks Beer', 'Bud Light', 'Budweiser', 'Busch', 'Michelob ULTRA', 'Shock Top', 'Stella Artois', 'BonViv', 'Bud Light Seltzer', 'Cutwater Spirits''Shock Top', 'Stella Artois', 'BonViv', 'Bud Light Seltzer', 'Cutwater Spirits']",0.10322067,[],[],0
Subway,AD0294,0.0,"Arc Oi and participation may vary Plus tax where applicable Excludes Supreme Subs Additional charge for Extras Prices higher in Alaska and Hawaii WEE s registered trademark of Doctors Associates Ind REGULAR SUBWAY way com Mice fresh eat My favorite month? Feb... February. February. Exactly. February. It's February. It's February. Is that right? It's February. It's Subway. It's what? It's February. Oh, gosh. It's February. My favorite month? February. It's February. Hard to say, easy to love, because many of our scrumptious footlongs are $5 footlongs, and we've got amazing $6 footlong specials, too. Subway. Wait, what was it again?",1.0204081632653061,['higher'],[],[],['higher'],Quick Service Restaurants & Food Chains,"['fresh', 'enjoy', 'organic', 'natural', 'delicious', 'quick', 'tasty', 'crispy', 'cheesy', 'juicy', 'hot', 'flavorful', 'spicy', 'tender', 'crunchy', 'smoky', 'rich', 'satisfying', 'affordable', 'fast', 'convenient', 'classic', 'loaded', 'grilled', 'indulgent', 'filling', 'tempting', 'iconic', 'specials', 'flavor', 'taste', 'freshness', 'crunch', 'aroma', 'variety', 'deal', 'toppings', 'spices', 'menu', 'satisfaction', 'indulgence', 'quality']","['BurgerKing', 'Chipotle', 'HardRock', 'JimmyJohns', 'KFC', 'LittleCaesars', 'McDonalds', 'Subway', 'TacoBell', 'Wendys']",0.24523243,[],['fresh'],1
